<?xml version="1.0" encoding="UTF-8"?>
<!DOCTYPE ags:resources SYSTEM "../../agrislegacy.dtd">
<ags:resources xmlns:ags="http://purl.org/agmes/1.1/" xmlns:dc="http://purl.org/dc/elements/1.1/" xmlns:agls="http://www.naa.gov.au/recordkeeping/gov_online/agls/1.2" xmlns:dcterms="http://purl.org/dc/terms/">
  <ags:resource ags:ARN="TN7500009">
<dc:title xml:lang="en">[Current statement concerning the cereals sector and production development [in Tunisia]</dc:title>
<dc:creator>
<ags:creatorCorporate>Ministere de l'Agriculture, Tunis (Tunisia). Direction de la Production Agricole</ags:creatorCorporate>
</dc:creator>
<dc:publisher><ags:publisherPlace>Tunis (Tunisia)</ags:publisherPlace>
</dc:publisher>
<dc:date>
<dcterms:dateIssued>Dec 1974</dcterms:dateIssued>
</dc:date>
<dc:subject>
<ags:subjectClassification scheme="ags:ASC">F00</ags:subjectClassification>
<ags:subjectClassification scheme="ags:ASC">E10</ags:subjectClassification>
<ags:subjectClassification scheme="ags:ASC">E70</ags:subjectClassification>
</dc:subject>
<dc:description><ags:descriptionNotes>5 tables. Received at CNDA Apr 1975</ags:descriptionNotes>
</dc:description>
<dc:type>V</dc:type>
<dc:format><dcterms:extent>13 p.</dcterms:extent></dc:format>
<dc:language scheme="ags:ISO639-1">Fr</dc:language>
<agls:availability><ags:availabilityLocation>TN</ags:availabilityLocation><ags:availabilityNumber>7500009</ags:availabilityNumber></agls:availability>
</ags:resource>
</ags:resources>
